{
  "schema-version": 3,
  "scope": "capability-modules",
  "rating-buckets": {
    "top-ready": [
      "ai-agent-loop-and-state-control",
      "ai-chunking-ranking-and-grounding",
      "ai-eval-design-and-acceptance",
      "ai-guardrail-policy-and-fallbacks",
      "ai-latency-cost-and-reliability",
      "ai-retrieval-objective-and-corpus-shaping",
      "ai-task-definition",
      "ai-tool-authority-and-boundaries",
      "architecture-decision-framing",
      "architecture-middleware-evolution",
      "architecture-migration-and-rollback",
      "architecture-option-scoring",
      "architecture-org-and-ownership-tradeoffs",
      "architecture-pattern-selection",
      "architecture-performance-architecture",
      "architecture-platform-governance",
      "architecture-reliability-and-ha",
      "architecture-requirements-and-constraints",
      "architecture-security-architecture",
      "chart-visualization-chart-image-api",
      "chart-visualization-g2-annotations-and-reference-marks",
      "chart-visualization-g2-chart-selection",
      "chart-visualization-g2-components-and-layout",
      "chart-visualization-g2-data-scales-and-coordinates",
      "chart-visualization-g2-interaction-and-tooltips",
      "chart-visualization-g2-mark-and-transform-basics",
      "chart-visualization-g2-shared-tooltip-and-navigation",
      "chart-visualization-g2-spec-guardrails",
      "chart-visualization-icon-retrieval-api",
      "chart-visualization-infographic-dsl",
      "chart-visualization-narrative-t8",
      "chart-visualization-s2-advanced-table-features",
      "chart-visualization-s2-customization-and-extensions",
      "chart-visualization-s2-framework-bindings",
      "chart-visualization-s2-sheet-model-and-config",
      "claymorphism-accessibility-and-responsive-constraints",
      "claymorphism-component-recipes",
      "claymorphism-surface-and-shadow-system",
      "data-batch-and-orchestration",
      "data-contracts-quality-and-reconciliation",
      "data-product-framing",
      "data-streaming-and-state",
      "development-batching-caching-and-concurrency",
      "development-bottleneck-diagnosis",
      "development-config-and-runtime-boundaries",
      "development-observability-and-shutdown",
      "development-python-concurrency",
      "development-python-design-and-types",
      "development-python-memory-and-runtime",
      "development-query-shape-and-orm",
      "development-transactions-pagination-and-write-paths",
      "devops-alerts-runbooks-and-diagnosis",
      "devops-release-gate-design",
      "devops-rollback-and-release-operations",
      "devops-signal-design-and-instrumentation",
      "frontend-design-hierarchy-and-visual-systems",
      "frontend-design-information-architecture",
      "frontend-design-information-architecture-and-interaction",
      "frontend-design-interaction-patterns",
      "frontend-design-motion-and-state-transitions",
      "frontend-design-responsive-and-implementation-constraints",
      "glassmorphism-accessibility-and-responsive-constraints",
      "glassmorphism-component-recipes",
      "glassmorphism-layering-and-contrast",
      "host-governance-boundaries-and-escalations",
      "host-governance-decision-rules",
      "host-governance-deep-reference-index",
      "infrastructure-cluster-shape-and-environment-strategy",
      "infrastructure-control-plane-and-tenancy",
      "infrastructure-dr-exercises-and-recovery-operations",
      "infrastructure-failover-topology-and-consistency",
      "infrastructure-runtime-policy-and-identity-plane",
      "infrastructure-traffic-governance-and-mesh-adoption",
      "liquid-glass-component-recipes",
      "liquid-glass-depth-and-motion-language",
      "liquid-glass-fallback-contrast-and-legibility",
      "mobile-battery-and-performance-budget",
      "mobile-lifecycle-and-interruption",
      "mobile-lifecycle-and-state",
      "mobile-native-bridge-and-platform-boundaries",
      "mobile-offline-sync-and-conflict",
      "mobile-permission-and-privacy-boundaries",
      "mobile-release-and-observability",
      "neubrutalism-accessibility-and-density-controls",
      "neubrutalism-component-recipes",
      "neubrutalism-graphic-hierarchy-and-tokens",
      "orchestration-dependency-and-integration",
      "orchestration-ownership-and-write-boundaries",
      "orchestration-status-and-handoffs",
      "orchestration-work-decomposition",
      "reliability-governance-boundaries-and-escalations",
      "reliability-governance-decision-rules",
      "reliability-governance-deep-reference-index",
      "review-cause-model-and-proof",
      "review-ci-signal-quality",
      "review-findings-and-severity",
      "review-git-and-pr-discipline",
      "review-mocks-fixtures-and-isolation",
      "review-recurrence-prevention-and-defect-governance",
      "review-release-readiness-and-rollback",
      "review-test-surface-mapping",
      "security-authn-authz-boundaries",
      "security-detection-response-and-recovery",
      "security-layered-controls-and-trust-zones",
      "security-secret-lifecycle-and-rotation",
      "skill-management-authoritative-crud"
    ],
    "strong-but-not-top": [],
    "thin": []
  },
  "counts": {
    "thin": 0,
    "strong-but-not-top": 0,
    "top-ready": 106,
    "total": 106
  },
  "skill-level-summary": {
    "source": "docs/SKILL_TOP_LEVEL_AUDIT_2026-04-20.md",
    "top-level-enough-now": [
      "ai",
      "architecture",
      "architecture-decision",
      "bugfix",
      "chart-visualization",
      "claymorphism",
      "data-engineering",
      "development",
      "devops",
      "frontend-design",
      "glassmorphism",
      "host-governance",
      "infrastructure",
      "investigate",
      "liquid-glass",
      "mobile",
      "multi-agent",
      "neubrutalism",
      "orchestration",
      "reliability-governance",
      "review",
      "sage",
      "security",
      "ship",
      "skill-evolution"
    ],
    "strong-uplift-but-not-top-yet": [
      "gen-docs",
      "imagegen",
      "manage-skill",
      "plugin-creator",
      "pre-commit-gate",
      "pre-merge-gate",
      "verify-change",
      "verify-chart-spec",
      "verify-module",
      "verify-quality",
      "verify-s2-config",
      "verify-security",
      "verify-skill-system"
    ],
    "useful-overlay-not-top-level-alone": [],
    "counts": {
      "top-level-enough-now": 25,
      "strong-uplift-but-not-top-yet": 13,
      "useful-overlay-not-top-level-alone": 0,
      "total-skills-rated": 38,
      "stable-overdue": 0,
      "stable-missing-metadata": 0,
      "stable-expert-source-blocked": 0,
      "stable-route-evidence-blocked": 0,
      "stable-runtime-proof-blocked": 11,
      "stable-host-smoke-blocked": 0,
      "stable-module-depth-blocked": 0,
      "stable-blocked-total": 11
    }
  },
  "next-batch": [],
  "notes": [
    "This file rates capability modules, not whole skills.",
    "All 106 currently registered capability modules are TOP-ready in the current governed frame.",
    "Current host skills are split across the top-level, strong-uplift, and overlay buckets under the weak-model-uplift standard.",
    "11 stable skills are temporarily outside 'top-level-enough-now' because of 11 runtime-proof blocker."
  ]
}
